category,title,summary,link,published,authors,summary_short
cs.CL,PragExTra: A Multilingual Corpus of Pragmatic Explicitation in   Translation,"Translators often enrich texts with background details that make implicit cultural meanings explicit for new audiences. This phenomenon, known as pragmatic explicitation, has been widely discussed in translation theory but rarely modeled computationally. We introduce PragExTra, the first multilingual corpus and detection framework for pragmatic explicitation. The corpus covers eight language pairs from TED-Multi and Europarl and includes additions such as entity descriptions, measurement conversions, and translator remarks. We identify candidate explicitation cases through null alignments and refined using active learning with human annotation. Our results show that entity and system-level explicitations are most frequent, and that active learning improves classifier accuracy by 7-8 percentage points, achieving up to 0.88 accuracy and 0.82 F1 across languages. PragExTra establishes pragmatic explicitation as a measurable, cross-linguistic phenomenon and takes a step towards building culturally aware machine translation. Keywords: translation, multilingualism, explicitation",http://arxiv.org/abs/2511.02721v1,2025-11-04T16:44:57Z,"Doreen Osmelak, Koel Dutta Chowdhury, Uliana Sentsova, Cristina España-Bonet, Josef van Genabith","**Unlocking Cultural Context in Translation: Introducing PragExTra**

When translating texts from one language to another, translators often add details to help readers understand cultural references that might be unfamiliar to them. This process, called ""pragmatic explicitation,"" makes implicit meanings explicit, ensuring the translated text is clear and accessible to a new audience.

Researchers have now created a groundbreaking multilingual corpus, called PragExTra, to study and model this phenomenon computationally. The corpus covers eight language pairs and includes examples of added explanations, such as descriptions of entities, conversions of measurements, and translator notes.

The study found that the most common types of explicitation involve adding information about entities and systems. By using a technique called active learning, which involves human annotation and machine learning, the researchers achieved high accuracy in detecting explicitation cases, with accuracy rates of up to 0.88 and F1 scores of up to 0.82 across languages.

The creation of PragExTra marks a significant step towards developing more culturally aware machine translation systems. By better understanding how translators add context to texts, researchers can improve machine translation and make it more effective in conveying cultural nuances."
cs.CL,The Collaboration Gap,"The trajectory of AI development suggests that we will increasingly rely on agent-based systems composed of independently developed agents with different information, privileges, and tools. The success of these systems will critically depend on effective collaboration among these heterogeneous agents, even under partial observability. Despite intense interest, few empirical studies have evaluated such agent-agent collaboration at scale. We propose a collaborative maze-solving benchmark that (i) isolates collaborative capabilities, (ii) modulates problem complexity, (iii) enables scalable automated grading, and (iv) imposes no output-format constraints, preserving ecological plausibility. Using this framework, we evaluate 32 leading open- and closed-source models in solo, homogeneous, and heterogeneous pairings. Our results reveal a ""collaboration gap"": models that perform well solo often degrade substantially when required to collaborate. Collaboration can break down dramatically; for instance, small distilled models that solve mazes well alone may fail almost completely in certain pairings. We find that starting with the stronger agent often improves outcomes, motivating a ""relay inference"" approach where the stronger agent leads before handing off to the weaker one, closing much of the gap. Our findings argue for (1) collaboration-aware evaluation, (2) training strategies developed to enhance collaborative capabilities, and (3) interaction design that reliably elicits agents' latent skills, guidance that applies to AI-AI and human-AI collaboration.",http://arxiv.org/abs/2511.02687v1,2025-11-04T16:10:57Z,"Tim R. Davidson, Adam Fourney, Saleema Amershi, Robert West, Eric Horvitz, Ece Kamar","**The Collaboration Gap: A Challenge in AI Development**

As AI technology advances, it's becoming increasingly important for different AI systems to work together effectively. However, a new study reveals that even the best AI models struggle to collaborate with each other. Researchers created a benchmark to test the collaborative abilities of 32 leading AI models, pairing them in different combinations to solve maze problems.

The study found that AI models that perform well on their own often degrade significantly when required to collaborate. In some cases, smaller models that are good at solving mazes alone may fail almost completely when paired with another model. The researchers also discovered that letting the stronger model lead and then handing off to the weaker one can improve collaboration.

The study's findings have important implications for the development of AI systems. They highlight the need for:

1. **Collaboration-aware evaluation**: Testing AI models not just on their individual performance, but also on their ability to work with others.
2. **Training strategies to enhance collaboration**: Developing AI models that are specifically designed to work effectively with other models.
3. **Interaction design that brings out the best in AI models**: Designing systems that allow AI models to interact with each other in a way that leverages their strengths.

These insights are relevant not only to AI-AI collaboration but also to human-AI collaboration, and will be crucial for the development of effective and efficient AI systems in the future."
cs.CL,Optimal Singular Damage: Efficient LLM Inference in Low Storage Regimes,"Large language models (LLMs) are increasingly prevalent across diverse applications. However, their enormous size limits storage and processing capabilities to a few well-resourced stakeholders. As a result, most applications rely on pre-trained LLMs, fine-tuned for specific tasks. However, even storing the fine-tuned versions of these models remains a significant challenge due to the wide range of tasks they address. Recently, studies show that fine-tuning these models primarily affects a small fraction of parameters, highlighting the need for more efficient storage of fine-tuned models. This paper focuses on efficient storage of parameter updates in pre-trained models after fine-tuning. To address this challenge, we leverage the observation that fine-tuning updates are both low-rank and sparse, which can be utilized for storage efficiency. However, using only low-rank approximation or sparsification may discard critical singular components that enhance model expressivity. We first observe that given the same memory budget, sparsified low-rank approximations with larger ranks outperform standard low-rank approximations with smaller ranks. Building on this, we propose our method, optimal singular damage, that selectively sparsifies low-rank approximated updates by leveraging the interleaved importance of singular vectors, ensuring that the most impactful components are retained. We demonstrate through extensive experiments that our proposed methods lead to significant storage efficiency and superior accuracy within the same memory budget compared to employing the low-rank approximation or sparsification individually.",http://arxiv.org/abs/2511.02681v1,2025-11-04T16:05:25Z,"Mohammadsajad Alipour, Mohammad Mohammadi Amiri","Here's a summary of the research paper ""Optimal Singular Damage: Efficient LLM Inference in Low Storage Regimes"" for a general audience:

**The Problem:** Large language models (LLMs) are powerful tools used in many applications, but they're huge and require a lot of storage space. This limits who can use them and how they're used.

**The Goal:** Researchers want to find a way to store these models more efficiently, especially when they're customized for specific tasks.

**The Breakthrough:** The researchers discovered that when LLMs are customized (or ""fine-tuned"") for a task, only a small part of the model's parameters change. They also found that these changes can be stored in a more compact way.

**The Solution:** The researchers developed a method called ""optimal singular damage"" that selectively stores the most important changes to the model, while discarding less important ones. This approach combines two techniques: reducing the complexity of the changes (using ""low-rank approximation"") and removing unnecessary data (using ""sparsification"").

**The Result:** The new method allows for significant storage efficiency while maintaining the model's accuracy. In other words, it enables more people to use customized LLMs, even with limited storage resources.

**In Simple Terms:** Imagine you have a huge library with millions of books, but you only need to store a few specific books. The researchers found a way to store just the changes to those books, rather than the entire library, making it much more efficient. This can help make powerful language models more accessible to more people."
cs.CL,"Understanding New-Knowledge-Induced Factual Hallucinations in LLMs:   Analysis, Solution, and Interpretation","Previous studies show that introducing new knowledge during large language models (LLMs) fine-tuning can lead to the generation of erroneous output when tested on known information, thereby triggering factual hallucinations. However, existing studies have not deeply investigated the specific manifestations and underlying mechanisms of these hallucinations. Our work addresses this gap by designing a controlled dataset Biography-Reasoning, and conducting a fine-grained analysis across multiple knowledge types and two task types, including knowledge question answering (QA) and knowledge reasoning tasks. We find that when fine-tuned on a dataset in which a specific knowledge type consists entirely of new knowledge, LLMs exhibit significantly increased hallucination tendencies. This suggests that the high unfamiliarity of a particular knowledge type, rather than the overall proportion of new knowledge, is a stronger driver of hallucinations, and these tendencies can even affect other knowledge types in QA tasks. To mitigate such factual hallucinations, we propose KnownPatch, which patches a small number of known knowledge samples in the later stages of training, effectively alleviating new-knowledge-induced hallucinations. Through attention analysis, we find that learning new knowledge reduces the model's attention to key entities in the question, thus causing excessive focus on the surrounding context, which may increase the risk of hallucination. Moreover, the attention pattern can propagate to similar contexts, facilitating the spread of hallucinations to textually similar questions. Our method effectively mitigates the disruption of new knowledge learning to the model's attention on key entities, accompanied by improved performance.",http://arxiv.org/abs/2511.02626v1,2025-11-04T14:55:24Z,"Renfei Dang, Peng Hu, Changjiang Gao, Shujian Huang","**The Dark Side of Learning New Things: How AI Models Can Get Facts Wrong**

Imagine you're teaching a student new information, but in the process, they start getting facts wrong that they previously knew. This phenomenon has been observed in large language models (LLMs), which are a type of artificial intelligence (AI) designed to understand and generate human-like text. Researchers have found that when LLMs learn new information, they can sometimes generate incorrect outputs, known as ""factual hallucinations,"" when tested on facts they already knew.

In a recent study, researchers investigated this issue by creating a special dataset called Biography-Reasoning. They found that when LLMs are fine-tuned on a dataset with entirely new information, they are more likely to generate incorrect outputs. This suggests that the unfamiliarity of new information, rather than the amount of new information, is a major driver of factual hallucinations.

The researchers also discovered that this problem can spread to similar questions and contexts, making it a significant challenge for LLMs. To address this issue, they proposed a solution called KnownPatch, which involves adding a small number of known facts to the training data. This approach was found to effectively reduce factual hallucinations and improve the model's performance.

The study also shed light on why this happens. When LLMs learn new information, they tend to focus less on key entities in the question and more on the surrounding context, which can lead to incorrect outputs. The researchers found that their method, KnownPatch, can help mitigate this issue by restoring the model's attention to key entities.

Overall, this study highlights the importance of carefully designing training data and methods to prevent factual hallucinations in LLMs. By understanding the causes of this problem and developing effective solutions, researchers can improve the accuracy and reliability of AI models."
cs.CL,The Realignment Problem: When Right becomes Wrong in LLMs,"The alignment of Large Language Models (LLMs) with human values is central to their safe deployment, yet current practice produces static, brittle, and costly-to-maintain models that fail to keep pace with evolving norms and policies. This misalignment, which we term the Alignment-Reality Gap, poses a growing challenge for reliable long-term use. Existing remedies are inadequate: large-scale re-annotation is economically prohibitive, and standard unlearning methods act as blunt instruments that erode utility rather than enable precise policy updates. We introduce TRACE (Triage and Re-align by Alignment Conflict Evaluation), a framework for principled unlearning that reconceives re-alignment as a programmatic policy application problem. TRACE programmatically triages existing preference data against a new policy, identifies high-impact conflicts via a alignment impact score, and applies a hybrid optimization that cleanly inverts, discards, or preserves preferences while safeguarding model performance. Empirical results show that TRACE achieves robust re-alignment across diverse model families (Qwen2.5-7B, Gemma-2-9B, Llama-3.1-8B). On both synthetic benchmarks and the PKU-SafeRLHF dataset under complex policy shift, TRACE enforces new principles without degrading general capabilities. Our work establishes a scalable, dynamic, and cost-effective paradigm for maintaining LLM alignment, providing a foundation for sustainable and responsible AI deployment.",http://arxiv.org/abs/2511.02623v1,2025-11-04T14:52:58Z,"Aakash Sen Sharma, Debdeep Sanyal, Vivek Srivastava, Shirish Karande, Murari Mandal","**The Challenge of Keeping AI Models Aligned with Human Values**

Large Language Models (LLMs) are powerful tools that can process and generate vast amounts of text. However, as societal norms and policies evolve, these models can become outdated and misaligned with human values. This misalignment can lead to models producing content that is no longer acceptable or safe.

**The Problem: Static Models Can't Keep Up**

Currently, updating LLMs to reflect changing values is a time-consuming and expensive process. Existing methods for updating models can be overly broad, causing them to lose their usefulness. This creates a significant challenge for the long-term reliability and safety of LLMs.

**A New Solution: TRACE**

Researchers have introduced a new framework called TRACE, which enables LLMs to be updated in a more precise and efficient way. TRACE works by:

1. Identifying conflicts between existing model data and new policies
2. Prioritizing high-impact conflicts
3. Applying targeted updates to the model

**Promising Results**

Tests of TRACE have shown promising results, with the framework successfully updating LLMs across different model families and datasets. Notably, TRACE was able to enforce new principles without degrading the model's general capabilities. This breakthrough has the potential to enable more sustainable and responsible AI deployment.

**Implications**

The development of TRACE marks an important step towards creating more dynamic and adaptable LLMs that can keep pace with evolving human values. By providing a scalable, cost-effective, and precise method for updating models, TRACE can help ensure that LLMs remain safe and reliable over time."
cs.CL,UniChange: Unifying Change Detection with Multimodal Large Language   Model,"Change detection (CD) is a fundamental task for monitoring and analyzing land cover dynamics. While recent high performance models and high quality datasets have significantly advanced the field, a critical limitation persists. Current models typically acquire limited knowledge from single-type annotated data and cannot concurrently leverage diverse binary change detection (BCD) and semantic change detection (SCD) datasets. This constraint leads to poor generalization and limited versatility. The recent advancements in Multimodal Large Language Models (MLLMs) introduce new possibilities for a unified CD framework. We leverage the language priors and unification capabilities of MLLMs to develop UniChange, the first MLLM-based unified change detection model. UniChange integrates generative language abilities with specialized CD functionalities. Our model successfully unifies both BCD and SCD tasks through the introduction of three special tokens: [T1], [T2], and [CHANGE]. Furthermore, UniChange utilizes text prompts to guide the identification of change categories, eliminating the reliance on predefined classification heads. This design allows UniChange to effectively acquire knowledge from multi-source datasets, even when their class definitions conflict. Experiments on four public benchmarks (WHU-CD, S2Looking, LEVIR-CD+, and SECOND) demonstrate SOTA performance, achieving IoU scores of 90.41, 53.04, 78.87, and 57.62, respectively, surpassing all previous methods. The code is available at https://github.com/Erxucomeon/UniChange.",http://arxiv.org/abs/2511.02607v1,2025-11-04T14:31:06Z,"Xu Zhang, Danyang Li, Xiaohang Dong, Tianhao Wu, Hualong Yu, Jianye Wang, Qicheng Li, Xiang Li","**Breakthrough in Land Cover Change Detection: UniChange**

Imagine being able to track changes in the Earth's surface, such as deforestation, urbanization, or natural disasters, with unprecedented accuracy. A new research paper introduces UniChange, a revolutionary model that unifies change detection using a multimodal large language model.

**The Problem:**
Current change detection models are limited by their reliance on single-type data and can't effectively leverage diverse datasets. This leads to poor performance and limited versatility.

**The Solution:**
UniChange overcomes these limitations by integrating language capabilities with specialized change detection functionalities. This allows the model to learn from multiple datasets, including those with conflicting class definitions.

**Key Innovations:**

* UniChange uses three special tokens to identify changes between two images.
* The model utilizes text prompts to guide the identification of change categories, eliminating the need for predefined classification heads.

**Results:**
Experiments on four public benchmarks demonstrate state-of-the-art performance, surpassing all previous methods. UniChange achieved impressive IoU scores, ranging from 53.04 to 90.41, indicating a significant improvement in change detection accuracy.

**Impact:**
The UniChange model has the potential to transform the field of land cover change detection, enabling more accurate monitoring and analysis of environmental changes. The code is available open-source, allowing researchers and practitioners to build upon this innovation."
cs.CL,CGES: Confidence-Guided Early Stopping for Efficient and Accurate   Self-Consistency,"Large language models (LLMs) are often queried multiple times at test time, with predictions aggregated by majority vote. While effective, this self-consistency strategy (arXiv:2203.11171) requires a fixed number of calls and can fail when the correct answer is rare. We introduce Confidence-Guided Early Stopping (CGES), a Bayesian framework that forms posteriors over candidate answers using scalar confidence signals derived from token probabilities or reward models. CGES adaptively halts sampling once the posterior mass of a candidate exceeds a threshold. We provide theoretical guarantees for both perfectly calibrated confidences and realistic noisy confidence signals. Across five reasoning benchmarks, CGES reduces the average number of model calls by about 69 percent (for example, from 16.0 to 4.9) while matching the accuracy of self-consistency within 0.06 percentage points.",http://arxiv.org/abs/2511.02603v1,2025-11-04T14:25:54Z,"Ehsan Aghazadeh, Ahmad Ghasemi, Hedyeh Beyhaghi, Hossein Pishro-Nik","**Improving Efficiency in AI Models with Confidence-Guided Early Stopping**

Large language models, like those used in chatbots and virtual assistants, often make predictions by querying the model multiple times and taking a majority vote. However, this approach can be inefficient and may not work well when the correct answer is not a popular choice.

Researchers have developed a new method called Confidence-Guided Early Stopping (CGES), which uses a Bayesian framework to make predictions more efficiently and accurately. CGES works by tracking the confidence of the model's predictions and stopping the querying process when the model is confident enough in its answer.

In tests across five reasoning benchmarks, CGES was able to reduce the number of model calls by about 69%, while still achieving similar accuracy to the traditional self-consistency method. This means that CGES can make predictions more quickly and efficiently, without sacrificing accuracy.

The benefits of CGES include:

* Reduced computational costs: By stopping the querying process early, CGES can save computing resources and reduce the time it takes to make predictions.
* Improved efficiency: CGES can make predictions more quickly, making it more suitable for real-time applications.
* Maintained accuracy: Despite reducing the number of model calls, CGES is able to maintain similar accuracy to traditional methods.

Overall, CGES has the potential to improve the efficiency and accuracy of large language models, making them more practical and effective in a wide range of applications."
cs.CL,Next Token Knowledge Tracing: Exploiting Pretrained LLM Representations   to Decode Student Behaviour,"Modelling student knowledge is a key challenge when leveraging AI in education, with major implications for personalised learning. The Knowledge Tracing (KT) task aims to predict how students will respond to educational questions in learning environments, based on their prior interactions. Existing KT models typically use response correctness along with metadata like skill tags and timestamps, often overlooking the question text, which is an important source of pedagogical insight. This omission poses a lost opportunity while limiting predictive performance. We propose Next Token Knowledge Tracing (NTKT), a novel approach that reframes KT as a next-token prediction task using pretrained Large Language Models (LLMs). NTKT represents both student histories and question content as sequences of text, allowing LLMs to learn patterns in both behaviour and language. Our series of experiments significantly improves performance over state-of-the-art neural KT models and generalises much better to cold-start questions and users. These findings highlight the importance of question content in KT and demonstrate the benefits of leveraging pretrained representations of LLMs to model student learning more effectively.",http://arxiv.org/abs/2511.02599v1,2025-11-04T14:20:56Z,"Max Norris, Kobi Gal, Sahan Bulathwela","Here's a summary of the research paper for a general audience:

**Improving AI in Education: A New Approach to Understanding Student Learning**

Researchers have made a breakthrough in using artificial intelligence (AI) to personalize learning for students. The challenge is to model how students learn and respond to questions in educational settings. Current AI models use data such as student responses and timestamps, but often ignore the actual text of the questions.

A team of researchers has developed a new approach called Next Token Knowledge Tracing (NTKT). This method uses large language models, like those used in chatbots, to analyze both the student's past responses and the text of the questions. By treating student learning as a ""next token prediction"" task, similar to how language models predict the next word in a sentence, NTKT can better understand student behavior and learning patterns.

The results are promising: NTKT outperforms current state-of-the-art models in predicting student responses and is more effective for new questions and students. This research highlights the importance of considering the content of questions in understanding student learning and demonstrates the potential of using pre-trained language models to improve AI in education. Ultimately, this could lead to more effective personalized learning tools for students."
