category,title,summary,link,published,authors,summary_short
cs.CL,Evontree: Ontology Rule-Guided Self-Evolution of Large Language Models,"Large language models (LLMs) have demonstrated exceptional capabilities across multiple domains by leveraging massive pre-training and curated fine-tuning data. However, in data-sensitive fields such as healthcare, the lack of high-quality, domain-specific training corpus hinders LLMs' adaptation for specialized applications. Meanwhile, domain experts have distilled domain wisdom into ontology rules, which formalize relationships among concepts and ensure the integrity of knowledge management repositories. Viewing LLMs as implicit repositories of human knowledge, we propose Evontree, a novel framework that leverages a small set of high-quality ontology rules to systematically extract, validate, and enhance domain knowledge within LLMs, without requiring extensive external datasets. Specifically, Evontree extracts domain ontology from raw models, detects inconsistencies using two core ontology rules, and reinforces the refined knowledge via self-distilled fine-tuning. Extensive experiments on medical QA benchmarks with Llama3-8B-Instruct and Med42-v2 demonstrate consistent outperformance over both unmodified models and leading supervised baselines, achieving up to a 3.7% improvement in accuracy. These results confirm the effectiveness, efficiency, and robustness of our approach for low-resource domain adaptation of LLMs.",http://arxiv.org/abs/2510.26683v1,2025-10-30T16:53:45Z,"Mingchen Tu, Zhiqiang Liu, Juan Li, Liangyurui Liu, Junjie Wang, Lei Liang, Wen Zhang","**Improving Large Language Models with Ontology Rules**

Large language models (LLMs) have shown impressive abilities in various fields, but they often struggle in specialized areas like healthcare due to a lack of high-quality training data. To address this issue, researchers have proposed a new framework called Evontree. Evontree uses a set of rules, known as ontology rules, to help LLMs learn and refine domain-specific knowledge without needing extensive external data.

The Evontree framework works by:

1. Extracting domain knowledge from the LLM
2. Identifying inconsistencies using ontology rules
3. Refining the knowledge through self-distilled fine-tuning

In tests on medical question-answering benchmarks, Evontree improved the performance of LLMs, achieving up to a 3.7% increase in accuracy. This approach shows promise for adapting LLMs to specialized domains with limited training data, making it a valuable tool for applications like healthcare.

**Key Takeaways:**

* Evontree is a novel framework that leverages ontology rules to improve LLMs in specialized domains
* It extracts, validates, and enhances domain knowledge within LLMs without requiring extensive external data
* Evontree demonstrates improved performance on medical QA benchmarks, achieving up to a 3.7% increase in accuracy."
cs.CL,The Era of Agentic Organization: Learning to Organize with Language   Models,"We envision a new era of AI, termed agentic organization, where agents solve complex problems by working collaboratively and concurrently, enabling outcomes beyond individual intelligence. To realize this vision, we introduce asynchronous thinking (AsyncThink) as a new paradigm of reasoning with large language models, which organizes the internal thinking process into concurrently executable structures. Specifically, we propose a thinking protocol where an organizer dynamically assigns sub-queries to workers, merges intermediate knowledge, and produces coherent solutions. More importantly, the thinking structure in this protocol can be further optimized through reinforcement learning. Experiments demonstrate that AsyncThink achieves 28% lower inference latency compared to parallel thinking while improving accuracy on mathematical reasoning. Moreover, AsyncThink generalizes its learned asynchronous thinking capabilities, effectively tackling unseen tasks without additional training.",http://arxiv.org/abs/2510.26658v1,2025-10-30T16:25:10Z,"Zewen Chi, Li Dong, Qingxiu Dong, Yaru Hao, Xun Wu, Shaohan Huang, Furu Wei","**The Future of AI: Collaborative Problem-Solving with Language Models**

Imagine a future where artificial intelligence (AI) systems can work together to solve complex problems, much like a team of humans. Researchers are now envisioning a new era of AI, called ""agentic organization,"" where AI agents collaborate and work together concurrently to achieve outcomes that surpass individual intelligence.

To make this vision a reality, the researchers have developed a new approach called ""asynchronous thinking"" (AsyncThink). This approach allows large language models to organize their internal thinking process into concurrently executable structures, similar to a team working on a project. An ""organizer"" assigns tasks to individual ""workers,"" which then merge their findings to produce a coherent solution.

The researchers tested AsyncThink and found that it not only improved the accuracy of mathematical reasoning but also reduced the time it took to solve problems by 28% compared to traditional parallel thinking approaches. Moreover, AsyncThink was able to generalize its learning to tackle new, unseen tasks without requiring additional training.

This breakthrough has the potential to revolutionize the way AI systems solve complex problems, enabling them to work together more efficiently and effectively. The possibilities for applications are vast, from improving decision-making in healthcare and finance to enhancing problem-solving in education and science."
cs.CL,Encoder-Decoder or Decoder-Only? Revisiting Encoder-Decoder Large   Language Model,"Recent large language model (LLM) research has undergone an architectural shift from encoder-decoder modeling to nowadays the dominant decoder-only modeling. This rapid transition, however, comes without a rigorous comparative analysis especially \textit{from the scaling perspective}, raising concerns that the potential of encoder-decoder models may have been overlooked. To fill this gap, we revisit encoder-decoder LLM (RedLLM), enhancing it with recent recipes from decoder-only LLM (DecLLM). We conduct a comprehensive comparison between RedLLM, pretrained with prefix language modeling (LM), and DecLLM, pretrained with causal LM, at different model scales, ranging from $\sim$150M to $\sim$8B. Using RedPajama V1 (1.6T tokens) for pretraining and FLAN for instruction tuning, our experiments show that RedLLM produces compelling scaling properties and surprisingly strong performance. While DecLLM is overall more compute-optimal during pretraining, RedLLM demonstrates comparable scaling and context length extrapolation capabilities. After instruction tuning, RedLLM achieves comparable and even better results on various downstream tasks while enjoying substantially better inference efficiency. We hope our findings could inspire more efforts on re-examining RedLLM, unlocking its potential for developing powerful and efficient LLMs.",http://arxiv.org/abs/2510.26622v1,2025-10-30T15:48:28Z,"Biao Zhang, Yong Cheng, Siamak Shakeri, Xinyi Wang, Min Ma, Orhan Firat","**Revisiting Encoder-Decoder Large Language Models: A Surprising Comeback**

Large language models (LLMs) are a type of artificial intelligence designed to process and generate human-like language. Recently, most LLMs have adopted a ""decoder-only"" architecture, abandoning the traditional ""encoder-decoder"" approach. However, a new study questions whether this shift was premature.

The researchers revived the encoder-decoder model, called RedLLM, and upgraded it with modern techniques used in decoder-only models (DecLLM). They compared the performance of both models at various scales, from 150 million to 8 billion parameters, using a massive dataset of 1.6 trillion tokens.

The surprising findings:

* Encoder-decoder models (RedLLM) can scale just as well as decoder-only models (DecLLM) and achieve comparable performance on many tasks.
* RedLLM models are more efficient during inference, meaning they can generate responses faster and with less computational power.
* After fine-tuning, RedLLM models performed equally well or even better than DecLLM models on various tasks.

These results suggest that encoder-decoder models may have been overlooked, and their potential for developing powerful and efficient LLMs warrants further exploration. The study's findings could inspire a re-examination of encoder-decoder models and lead to the creation of more efficient and effective language models."
cs.CL,SlideAgent: Hierarchical Agentic Framework for Multi-Page Visual   Document Understanding,"Multi-page visual documents such as manuals, brochures, presentations, and posters convey key information through layout, colors, icons, and cross-slide references. While large language models (LLMs) offer opportunities in document understanding, current systems struggle with complex, multi-page visual documents, particularly in fine-grained reasoning over elements and pages. We introduce SlideAgent, a versatile agentic framework for understanding multi-modal, multi-page, and multi-layout documents, especially slide decks. SlideAgent employs specialized agents and decomposes reasoning into three specialized levels-global, page, and element-to construct a structured, query-agnostic representation that captures both overarching themes and detailed visual or textual cues. During inference, SlideAgent selectively activates specialized agents for multi-level reasoning and integrates their outputs into coherent, context-aware answers. Extensive experiments show that SlideAgent achieves significant improvement over both proprietary (+7.9 overall) and open-source models (+9.8 overall).",http://arxiv.org/abs/2510.26615v1,2025-10-30T15:41:15Z,"Yiqiao Jin, Rachneet Kaur, Zhen Zeng, Sumitra Ganesh, Srijan Kumar","Here's a summary of the research paper for a general audience:

**Understanding Complex Documents Just Got Easier**

Imagine trying to make sense of a long, visually complex document like a manual, brochure, or presentation. Current computer systems struggle to understand the relationships between different parts of the document, especially when it spans multiple pages.

Researchers have developed a new framework called SlideAgent, which uses a team of specialized ""agents"" to work together to understand complex documents. These agents focus on different levels of the document, from the overall theme to individual elements like text and images.

SlideAgent has been tested on a variety of documents, including slide decks, and has shown significant improvements in understanding over existing systems - both commercial and open-source ones. This breakthrough has the potential to enable computers to better comprehend and summarize complex documents, making it easier for people to extract the information they need."
cs.CL,Normative Reasoning in Large Language Models: A Comparative Benchmark   from Logical and Modal Perspectives,"Normative reasoning is a type of reasoning that involves normative or deontic modality, such as obligation and permission. While large language models (LLMs) have demonstrated remarkable performance across various reasoning tasks, their ability to handle normative reasoning remains underexplored. In this paper, we systematically evaluate LLMs' reasoning capabilities in the normative domain from both logical and modal perspectives. Specifically, to assess how well LLMs reason with normative modals, we make a comparison between their reasoning with normative modals and their reasoning with epistemic modals, which share a common formal structure. To this end, we introduce a new dataset covering a wide range of formal patterns of reasoning in both normative and epistemic domains, while also incorporating non-formal cognitive factors that influence human reasoning. Our results indicate that, although LLMs generally adhere to valid reasoning patterns, they exhibit notable inconsistencies in specific types of normative reasoning and display cognitive biases similar to those observed in psychological studies of human reasoning. These findings highlight challenges in achieving logical consistency in LLMs' normative reasoning and provide insights for enhancing their reliability. All data and code are released publicly at https://github.com/kmineshima/NeuBAROCO.",http://arxiv.org/abs/2510.26606v2,2025-10-30T15:35:13Z,"Kentaro Ozeki, Risako Ando, Takanobu Morishita, Hirohiko Abe, Koji Mineshima, Mitsuhiro Okada","**Large Language Models Put to the Test: Can They Reason with Rules and Obligations?**

Large language models (LLMs) have become incredibly good at understanding and generating human-like text, but researchers are still exploring their limitations. One important area of reasoning is ""normative reasoning,"" which involves understanding rules, obligations, and permissions. For example, if someone says ""it's obligatory to wear a seatbelt while driving,"" a model should be able to infer that it's not allowed to drive without a seatbelt.

A new study evaluated the ability of LLMs to reason with normative statements, comparing their performance to reasoning with statements about knowledge and belief (epistemic modals). The researchers created a dataset that covers various formal patterns of reasoning in both areas, as well as factors that influence human thinking.

The results showed that while LLMs generally follow valid reasoning patterns, they struggle with specific types of normative reasoning and exhibit biases similar to those found in human reasoning studies. These findings highlight the challenges of achieving logical consistency in LLMs' normative reasoning and provide insights for improving their reliability.

**In simple terms:** LLMs are good at understanding text, but they still struggle with reasoning about rules and obligations. This study helps identify areas where LLMs need improvement, which is essential for developing more reliable and trustworthy language models. The researchers have made their data and code publicly available, which can help others build on their work."
cs.CL,Inference-Cost-Aware Dynamic Tree Construction for Efficient Inference   in Large Language Models,"Large Language Models (LLMs) face significant inference latency challenges stemming from their autoregressive design and large size. To address this, speculative decoding emerges as a solution, enabling the simultaneous generation and validation of multiple tokens. While recent approaches like EAGLE-2 and EAGLE-3 improve speculative decoding using dynamic tree structures, they often neglect the impact of crucial system variables such as GPU devices and batch sizes.   Therefore, we introduce a new dynamic tree decoding approach called CAST that takes into account inference costs, including factors such as GPU configurations and batch sizes, to dynamically refine the tree structure. Through comprehensive experimentation across six diverse tasks and utilizing six distinct LLMs, our methodology demonstrates remarkable results, achieving speeds up to 5.2 times faster than conventional decoding methods. Moreover, it generally outperforms existing state-of-the-art techniques from 5% to 20%.",http://arxiv.org/abs/2510.26577v1,2025-10-30T15:04:36Z,"Yinrong Hong, Zhiquan Tan, Kai Hu","**Breakthrough in Large Language Model Efficiency**

Researchers have made a significant advancement in speeding up Large Language Models (LLMs), which are AI systems that process and generate human-like language. The challenge with LLMs is that they can be slow due to their complex design and large size. To address this, the researchers developed a new method called CAST, which dynamically adjusts how the model generates text to make it more efficient.

**What makes CAST unique?**

Unlike previous methods, CAST takes into account important factors such as the type of computer hardware (like GPU devices) and how many tasks are being processed at once (batch sizes). By considering these factors, CAST builds a customized ""tree"" structure that allows the model to generate and validate multiple text tokens simultaneously, reducing the time it takes to produce output.

**Impressive results**

The researchers tested CAST on various tasks and LLMs, and the results are impressive: CAST can process text up to 5.2 times faster than traditional methods. Additionally, it outperforms existing state-of-the-art techniques by 5-20%. This breakthrough has the potential to significantly improve the efficiency and responsiveness of LLMs, making them more practical for real-world applications."
cs.CL,InfoFlow: Reinforcing Search Agent Via Reward Density Optimization,"Reinforcement Learning with Verifiable Rewards (RLVR) is a promising approach for enhancing agentic deep search. However, its application is often hindered by low \textbf{Reward Density} in deep search scenarios, where agents expend significant exploratory costs for infrequent and often null final rewards. In this paper, we formalize this challenge as the \textbf{Reward Density Optimization} problem, which aims to improve the reward obtained per unit of exploration cost. This paper introduce \textbf{InfoFlow}, a systematic framework that tackles this problem from three aspects. 1) \textbf{Subproblem decomposition}: breaking down long-range tasks to assign process rewards, thereby providing denser learning signals. 2) \textbf{Failure-guided hints}: injecting corrective guidance into stalled trajectories to increase the probability of successful outcomes. 3) \textbf{Dual-agent refinement}: employing a dual-agent architecture to offload the cognitive burden of deep exploration. A refiner agent synthesizes the search history, which effectively compresses the researcher's perceived trajectory, thereby reducing exploration cost and increasing the overall reward density. We evaluate InfoFlow on multiple agentic search benchmarks, where it significantly outperforms strong baselines, enabling lightweight LLMs to achieve performance comparable to advanced proprietary LLMs.",http://arxiv.org/abs/2510.26575v1,2025-10-30T15:03:21Z,"Kun Luo, Hongjin Qian, Zheng Liu, Ziyi Xia, Shitao Xiao, Siqi Bao, Jun Zhao, Kang Liu","Here's a summary of the research paper ""InfoFlow: Reinforcing Search Agent Via Reward Density Optimization"" for a general audience:

**Improving Search Agents with InfoFlow**

Imagine you're searching for a specific piece of information online. You might use a search engine to find relevant results, but the process can be time-consuming and frustrating. Researchers have been working on developing ""search agents"" that can help automate this process, but these agents often struggle to find what they're looking for efficiently.

The main challenge is that search agents typically only receive rewards or feedback when they finally find what they're looking for, which can be rare and far apart. This makes it hard for them to learn and improve over time.

To address this issue, researchers have developed a new framework called InfoFlow. InfoFlow aims to provide search agents with more frequent and relevant feedback, allowing them to learn and improve more efficiently.

InfoFlow works in three key ways:

1. **Breaking down tasks**: InfoFlow breaks down long search tasks into smaller, more manageable sub-tasks, providing the agent with more frequent rewards and feedback.
2. **Corrective guidance**: When the agent gets stuck, InfoFlow provides corrective guidance to help it get back on track.
3. **Dual-agent architecture**: InfoFlow uses two agents working together: one agent explores and searches, while the other agent helps refine and summarize the search history, making it easier to find what the agent is looking for.

The results are impressive: InfoFlow has been tested on several search benchmarks and has significantly outperformed existing methods. In fact, it has enabled lightweight language models to perform as well as more advanced, proprietary models.

Overall, InfoFlow has the potential to improve the efficiency and effectiveness of search agents, making it easier for us to find what we're looking for online."
cs.CL,The Structure of Relation Decoding Linear Operators in Large Language   Models,"This paper investigates the structure of linear operators introduced in Hernandez et al. [2023] that decode specific relational facts in transformer language models. We extend their single-relation findings to a collection of relations and systematically chart their organization. We show that such collections of relation decoders can be highly compressed by simple order-3 tensor networks without significant loss in decoding accuracy. To explain this surprising redundancy, we develop a cross-evaluation protocol, in which we apply each linear decoder operator to the subjects of every other relation. Our results reveal that these linear maps do not encode distinct relations, but extract recurring, coarse-grained semantic properties (e.g., country of capital city and country of food are both in the country-of-X property). This property-centric structure clarifies both the operators' compressibility and highlights why they generalize only to new relations that are semantically close. Our findings thus interpret linear relational decoding in transformer language models as primarily property-based, rather than relation-specific.",http://arxiv.org/abs/2510.26543v1,2025-10-30T14:36:09Z,"Miranda Anna Christ, Adrián Csiszárik, Gergely Becsó, Dániel Varga","**Unlocking the Secrets of Large Language Models: How They Understand Relationships**

Imagine you're asking a virtual assistant to tell you the capital of France. The assistant uses complex algorithms to retrieve this information, but have you ever wondered how it actually works? A recent study delved into the inner workings of large language models, like those used in chatbots and virtual assistants, to understand how they decode specific relationships between words.

The researchers found that these models use simple mathematical operators to extract relationships, such as ""capital of"" or ""food from,"" from vast amounts of text data. Surprisingly, they discovered that these operators are not unique to each relationship, but rather focus on broader semantic properties, like ""country of."" This means that the model is not specifically looking for the ""capital of"" relationship, but rather for information related to a country's properties.

The study also showed that these operators can be highly compressed, meaning they can be simplified without losing much accuracy. This is because they rely on these coarse-grained properties, which are shared across multiple relationships. Think of it like a filing system, where information is organized into broad categories rather than specific folders.

The findings have significant implications for how we understand large language models. They suggest that these models are not as nuanced as we thought, and that their ability to generalize to new relationships is limited to those that are semantically close to the ones they were trained on. In other words, if a model is trained on information about countries and capitals, it may struggle to understand relationships that are very different, like those between people and their favorite foods.

Overall, this study provides a deeper understanding of how large language models work, and highlights the importance of considering their limitations when designing and training these models."
