category,title,summary,link,published,authors,summary_short
cs.LG,OmniX: From Unified Panoramic Generation and Perception to   Graphics-Ready 3D Scenes,"There are two prevalent ways to constructing 3D scenes: procedural generation and 2D lifting. Among them, panorama-based 2D lifting has emerged as a promising technique, leveraging powerful 2D generative priors to produce immersive, realistic, and diverse 3D environments. In this work, we advance this technique to generate graphics-ready 3D scenes suitable for physically based rendering (PBR), relighting, and simulation. Our key insight is to repurpose 2D generative models for panoramic perception of geometry, textures, and PBR materials. Unlike existing 2D lifting approaches that emphasize appearance generation and ignore the perception of intrinsic properties, we present OmniX, a versatile and unified framework. Based on a lightweight and efficient cross-modal adapter structure, OmniX reuses 2D generative priors for a broad range of panoramic vision tasks, including panoramic perception, generation, and completion. Furthermore, we construct a large-scale synthetic panorama dataset containing high-quality multimodal panoramas from diverse indoor and outdoor scenes. Extensive experiments demonstrate the effectiveness of our model in panoramic visual perception and graphics-ready 3D scene generation, opening new possibilities for immersive and physically realistic virtual world generation.",http://arxiv.org/abs/2510.26800v1,2025-10-30T17:59:51Z,"Yukun Huang, Jiwen Yu, Yanning Zhou, Jianan Wang, Xintao Wang, Pengfei Wan, Xihui Liu","**Breakthrough in 3D Scene Creation: OmniX Revolutionizes Virtual World Generation**

Imagine being able to create immersive and realistic virtual worlds with ease. Researchers have made a significant step towards achieving this goal with the development of OmniX, a unified framework that generates high-quality 3D scenes from 2D images. This innovation has the potential to transform industries such as gaming, architecture, and film production.

**The Problem with Current 3D Scene Creation Methods**

Currently, there are two main ways to construct 3D scenes: procedural generation and 2D lifting. Procedural generation involves using algorithms to create 3D models from scratch, while 2D lifting involves converting 2D images into 3D scenes. However, both methods have limitations. Procedural generation can be time-consuming and may not produce realistic results, while 2D lifting often focuses on appearance rather than the underlying geometry and materials of the scene.

**How OmniX Works**

OmniX addresses these limitations by leveraging powerful 2D generative models to produce 3D scenes that are not only visually stunning but also physically accurate. This means that the generated scenes can be lit, rendered, and simulated in a way that mimics real-world physics. The key insight behind OmniX is to repurpose 2D generative models for panoramic perception of geometry, textures, and materials.

**Key Features of OmniX**

* **Graphics-ready 3D scenes**: OmniX generates 3D scenes that are suitable for physically based rendering, relighting, and simulation.
* **Panoramic perception**: OmniX can perceive and understand the geometry, textures, and materials of a scene from a single 2D image.
* **Efficient and versatile**: OmniX uses a lightweight and efficient cross-modal adapter structure, making it suitable for a broad range of panoramic vision tasks.

**Impact and Future Possibilities**

The implications of this research are significant, enabling the creation of:

* Highly realistic and immersive virtual environments for gaming, training, and simulation
* Accurate and detailed 3D models for architecture, product design, and urban planning
* Efficient and cost-effective workflows for film and video production

The development of OmniX marks an exciting milestone in the field of computer vision and graphics, opening up new possibilities for the creation of virtual worlds that are indistinguishable from reality."
cs.LG,Scaling Image Geo-Localization to Continent Level,"Determining the precise geographic location of an image at a global scale remains an unsolved challenge. Standard image retrieval techniques are inefficient due to the sheer volume of images (>100M) and fail when coverage is insufficient. Scalable solutions, however, involve a trade-off: global classification typically yields coarse results (10+ kilometers), while cross-view retrieval between ground and aerial imagery suffers from a domain gap and has been primarily studied on smaller regions. This paper introduces a hybrid approach that achieves fine-grained geo-localization across a large geographic expanse the size of a continent. We leverage a proxy classification task during training to learn rich feature representations that implicitly encode precise location information. We combine these learned prototypes with embeddings of aerial imagery to increase robustness to the sparsity of ground-level data. This enables direct, fine-grained retrieval over areas spanning multiple countries. Our extensive evaluation demonstrates that our approach can localize within 200m more than 68\% of queries of a dataset covering a large part of Europe. The code is publicly available at https://scaling-geoloc.github.io.",http://arxiv.org/abs/2510.26795v1,2025-10-30T17:59:35Z,"Philipp Lindenberger, Paul-Edouard Sarlin, Jan Hosang, Matteo Balice, Marc Pollefeys, Simon Lynen, Eduard Trulls","**Advances in Image Geo-Localization: A Breakthrough in Identifying Locations Across Continents**

Imagine being able to pinpoint the exact location of a photo taken anywhere in the world, from a bustling city street to a scenic countryside road. Researchers have made a significant breakthrough in achieving this goal, developing a new method that can accurately identify the location of an image across a vast geographic area, such as a continent.

The challenge lies in the sheer volume of images available (over 100 million) and the limited coverage of certain areas. Existing techniques are either inefficient or provide coarse results, often accurate to within several kilometers. The new approach, however, combines two key strategies to achieve fine-grained geo-localization.

By leveraging a proxy classification task during training, the researchers learned rich feature representations that encode precise location information. They then combined these learned prototypes with aerial imagery embeddings to increase robustness to sparse ground-level data. This enables direct, fine-grained retrieval over large areas, spanning multiple countries.

In an extensive evaluation, the researchers demonstrated that their approach can localize images within 200 meters of their actual location more than 68% of the time, across a dataset covering a significant part of Europe. This achievement has significant implications for various applications, including image retrieval, mapping, and surveillance.

The code for this new approach is publicly available, making it a valuable resource for researchers and developers working on image geo-localization tasks. This breakthrough brings us closer to accurately identifying the location of images taken anywhere in the world, with potential applications in fields such as environmental monitoring, urban planning, and more."
cs.LG,"Learning Pseudorandom Numbers with Transformers: Permuted Congruential   Generators, Curricula, and Interpretability","We study the ability of Transformer models to learn sequences generated by Permuted Congruential Generators (PCGs), a widely used family of pseudo-random number generators (PRNGs). PCGs introduce substantial additional difficulty over linear congruential generators (LCGs) by applying a series of bit-wise shifts, XORs, rotations and truncations to the hidden state. We show that Transformers can nevertheless successfully perform in-context prediction on unseen sequences from diverse PCG variants, in tasks that are beyond published classical attacks. In our experiments we scale moduli up to $2^{22}$ using up to $50$ million model parameters and datasets with up to $5$ billion tokens. Surprisingly, we find even when the output is truncated to a single bit, it can be reliably predicted by the model. When multiple distinct PRNGs are presented together during training, the model can jointly learn them, identifying structures from different permutations. We demonstrate a scaling law with modulus $m$: the number of in-context sequence elements required for near-perfect prediction grows as $\sqrt{m}$. For larger moduli, optimization enters extended stagnation phases; in our experiments, learning moduli $m \geq 2^{20}$ requires incorporating training data from smaller moduli, demonstrating a critical necessity for curriculum learning. Finally, we analyze embedding layers and uncover a novel clustering phenomenon: the model spontaneously groups the integer inputs into bitwise rotationally-invariant clusters, revealing how representations can transfer from smaller to larger moduli.",http://arxiv.org/abs/2510.26792v1,2025-10-30T17:59:09Z,"Tao Tao, Maissam Barkeshli","**Can AI Learn to Generate Random Numbers?**

Researchers have been testing the abilities of a type of artificial intelligence (AI) called Transformer models to learn and predict sequences of numbers generated by complex algorithms called pseudo-random number generators (PRNGs). These algorithms are used to create seemingly random numbers for various applications, such as simulations, modeling, and cryptography.

The researchers found that Transformer models can successfully learn and predict sequences from different types of PRNGs, even when the output is limited to a single bit (a basic unit of digital information). This is impressive, as these PRNGs use complex operations like bit-wise shifts, XORs, rotations, and truncations to generate numbers.

The study also showed that when the AI model is trained on multiple PRNGs simultaneously, it can identify common structures and learn to predict sequences from each of them. However, as the complexity of the PRNGs increases, the model requires more data and computational power to learn effectively.

Interestingly, the researchers discovered that the AI model groups integer inputs into clusters based on their rotational symmetry, which allows it to transfer knowledge from smaller to larger PRNGs. This finding has implications for the design of more efficient training methods.

The study's results have significant implications for the development of AI models that can learn and generate complex patterns, and could potentially lead to breakthroughs in areas like cryptography, simulations, and data analysis."
cs.LG,Defeating the Training-Inference Mismatch via FP16,"Reinforcement learning (RL) fine-tuning of large language models (LLMs) often suffers from instability due to the numerical mismatch between the training and inference policies. While prior work has attempted to mitigate this issue through algorithmic corrections or engineering alignments, we show that its root cause lies in the floating point precision itself. The widely adopted BF16, despite its large dynamic range, introduces large rounding errors that breaks the consistency between training and inference. In this work, we demonstrate that simply reverting to \textbf{FP16} effectively eliminates this mismatch. The change is simple, fully supported by modern frameworks with only a few lines of code change, and requires no modification to the model architecture or learning algorithm. Our results suggest that using FP16 uniformly yields more stable optimization, faster convergence, and stronger performance across diverse tasks, algorithms and frameworks. We hope these findings motivate a broader reconsideration of precision trade-offs in RL fine-tuning.",http://arxiv.org/abs/2510.26788v1,2025-10-30T17:58:11Z,"Penghui Qi, Zichen Liu, Xiangxin Zhou, Tianyu Pang, Chao Du, Wee Sun Lee, Min Lin","**Improving Stability in AI Training: A Simple yet Effective Solution**

Researchers have identified a major issue in fine-tuning large language models using reinforcement learning (RL). The problem, known as the ""training-inference mismatch,"" causes instability and inconsistent results. While previous solutions have attempted to fix this issue through complex algorithmic changes, this study reveals that the root cause lies in the way computers store and process numbers.

The researchers found that using a lower precision floating-point format, called FP16, can effectively eliminate this mismatch. Surprisingly, switching to FP16, which is a simple change that requires only a few lines of code, leads to more stable optimization, faster convergence, and better performance across various tasks and AI frameworks.

The implications of this study are significant, as it suggests that a simple change in the way computers process numbers can have a substantial impact on the stability and performance of AI models. The researchers hope that their findings will encourage a re-evaluation of the trade-offs between precision and performance in AI training, leading to more efficient and effective AI development."
cs.LG,Remote Labor Index: Measuring AI Automation of Remote Work,"AIs have made rapid progress on research-oriented benchmarks of knowledge and reasoning, but it remains unclear how these gains translate into economic value and automation. To measure this, we introduce the Remote Labor Index (RLI), a broadly multi-sector benchmark comprising real-world, economically valuable projects designed to evaluate end-to-end agent performance in practical settings. AI agents perform near the floor on RLI, with the highest-performing agent achieving an automation rate of 2.5%. These results help ground discussions of AI automation in empirical evidence, setting a common basis for tracking AI impacts and enabling stakeholders to proactively navigate AI-driven labor automation.",http://arxiv.org/abs/2510.26787v1,2025-10-30T17:58:04Z,"Mantas Mazeika, Alice Gatti, Cristina Menghini, Udari Madhushani Sehwag, Shivam Singhal, Yury Orlovskiy, Steven Basart, Manasi Sharma, Denis Peskoff, Elaine Lau, Jaehyuk Lim, Lachlan Carroll, Alice Blair, Vinaya Sivakumar, Sumana Basu, Brad Kenstler, Yuntao Ma, Julian Michael, Xiaoke Li, Oliver Ingebretsen, Aditya Mehta, Jean Mottola, John Teichmann, Kevin Yu, Zaina Shaik, Adam Khoja, Richard Ren, Jason Hausenloy, Long Phan, Ye Htet, Ankit Aich, Tahseen Rabbani, Vivswan Shah, Andriy Novykov, Felix Binder, Kirill Chugunov, Luis Ramirez, Matias Geralnik, Hernán Mesura, Dean Lee, Ed-Yeremai Hernandez Cardona, Annette Diamond, Summer Yue, Alexandr Wang, Bing Liu, Ernesto Hernandez, Dan Hendrycks","Here's a summary of the research paper for a general audience:

**Can AI Replace Human Workers Remotely?**

Researchers have made significant progress in developing artificial intelligence (AI) that can perform complex tasks. However, it's unclear how well these AI systems can actually automate real-world work, especially remote jobs. To find out, researchers created a new benchmark called the Remote Labor Index (RLI).

The RLI tests AI agents on real-world projects that require a range of skills, such as knowledge and reasoning. The results show that current AI agents are not very effective at automating remote work, with the best-performing AI achieving an automation rate of only 2.5%. This means that AI can only perform a small fraction of the tasks that humans do remotely.

These findings provide a reality check on the potential impact of AI on work and help set a baseline for tracking progress in AI automation. By understanding the current limitations of AI, stakeholders can better prepare for the changes that AI-driven automation may bring to the workforce."
cs.LG,HEIR: Learning Graph-Based Motion Hierarchies,"Hierarchical structures of motion exist across research fields, including computer vision, graphics, and robotics, where complex dynamics typically arise from coordinated interactions among simpler motion components. Existing methods to model such dynamics typically rely on manually-defined or heuristic hierarchies with fixed motion primitives, limiting their generalizability across different tasks. In this work, we propose a general hierarchical motion modeling method that learns structured, interpretable motion relationships directly from data. Our method represents observed motions using graph-based hierarchies, explicitly decomposing global absolute motions into parent-inherited patterns and local motion residuals. We formulate hierarchy inference as a differentiable graph learning problem, where vertices represent elemental motions and directed edges capture learned parent-child dependencies through graph neural networks. We evaluate our hierarchical reconstruction approach on three examples: 1D translational motion, 2D rotational motion, and dynamic 3D scene deformation via Gaussian splatting. Experimental results show that our method reconstructs the intrinsic motion hierarchy in 1D and 2D cases, and produces more realistic and interpretable deformations compared to the baseline on dynamic 3D Gaussian splatting scenes. By providing an adaptable, data-driven hierarchical modeling paradigm, our method offers a formulation applicable to a broad range of motion-centric tasks. Project Page: https://light.princeton.edu/HEIR/",http://arxiv.org/abs/2510.26786v1,2025-10-30T17:57:40Z,"Cheng Zheng, William Koch, Baiang Li, Felix Heide","**Unlocking the Secrets of Motion: A New Approach to Understanding Complex Movement**

Imagine you're watching a dancer perform a intricate routine. Their movement is made up of many smaller parts - the swing of their arms, the twirl of their body, and the tap of their feet. But how do we make sense of all these individual movements and how they work together to create the overall dance?

Researchers have long struggled to model complex motion, like the movement of a dancer or the deformation of a 3D object. Existing methods rely on pre-defined rules or assumptions about how the different parts of the motion fit together. But what if we could teach a computer to learn these relationships directly from data, without any preconceptions?

That's exactly what a team of researchers has done with their new method, called HEIR (Hierarchical Motion Modeling). By representing motion as a graph, where each node represents a simple movement and the edges represent the relationships between them, HEIR can learn to identify the underlying structure of complex motion.

In tests, HEIR was able to accurately reconstruct the motion of simple systems, like a ball moving in one or two dimensions. But it also showed promising results on more complex tasks, like deforming 3D objects. By providing a flexible and data-driven approach to motion modeling, HEIR has the potential to be applied to a wide range of fields, from computer vision and robotics to animation and beyond.

**Key Takeaways:**

* A new method, HEIR, learns to model complex motion by identifying the relationships between simple movement components.
* HEIR uses a graph-based approach to represent motion, allowing it to learn from data without pre-defined rules.
* The method shows promising results on a range of tasks, from simple motion to complex 3D deformations."
cs.LG,A Unified Theory for Causal Inference: Direct Debiased Machine Learning   via Bregman-Riesz Regression,"This note introduces a unified theory for causal inference that integrates Riesz regression, covariate balancing, density-ratio estimation (DRE), targeted maximum likelihood estimation (TMLE), and the matching estimator in average treatment effect (ATE) estimation. In ATE estimation, the balancing weights and the regression functions of the outcome play important roles, where the balancing weights are referred to as the Riesz representer, bias-correction term, and clever covariates, depending on the context. Riesz regression, covariate balancing, DRE, and the matching estimator are methods for estimating the balancing weights, where Riesz regression is essentially equivalent to DRE in the ATE context, the matching estimator is a special case of DRE, and DRE is in a dual relationship with covariate balancing. TMLE is a method for constructing regression function estimators such that the leading bias term becomes zero. Nearest Neighbor Matching is equivalent to Least Squares Density Ratio Estimation and Riesz Regression.",http://arxiv.org/abs/2510.26783v1,2025-10-30T17:56:47Z,Masahiro Kato,"**Unlocking the Secrets of Causal Inference: A New Unified Theory**

Imagine you're trying to figure out whether a new medicine actually works, or if a certain policy change has a positive impact on society. To do this, researchers use a technique called causal inference. A new study introduces a unified theory that brings together several existing methods for causal inference into one cohesive framework.

**The Goal: Estimating Cause-and-Effect Relationships**

The goal of causal inference is to estimate the average treatment effect (ATE), which is the difference in outcomes between two groups: one that receives a treatment (e.g., a medicine) and one that doesn't. The challenge is to ensure that the comparison is fair and accurate.

**The Key Players: Balancing Weights and Regression Functions**

The study identifies two crucial components in ATE estimation: balancing weights and regression functions. Balancing weights help to create a fair comparison between the two groups, while regression functions predict the outcome of interest.

**The Unified Theory: Connecting Different Methods**

The new theory shows that several existing methods are connected and can be seen as different approaches to estimating balancing weights and regression functions. These methods include:

1. **Riesz regression**: a way to estimate balancing weights
2. **Covariate balancing**: another approach to estimating balancing weights
3. **Density-ratio estimation**: a method that's equivalent to Riesz regression
4. **Targeted maximum likelihood estimation**: a method for constructing regression function estimators
5. **Matching estimator**: a special case of density-ratio estimation

**Implications and Applications**

This unified theory has significant implications for researchers and practitioners in various fields, including medicine, social sciences, and policy-making. By providing a comprehensive framework for causal inference, it can help to:

* Improve the accuracy of cause-and-effect estimates
* Facilitate the comparison of different methods
* Guide the choice of methods for specific research questions

In summary, the study introduces a unified theory for causal inference that integrates multiple existing methods, providing a more comprehensive and coherent framework for understanding cause-and-effect relationships."
