category,title,summary,link,published,authors,summary_short
cs.CV,SEE4D: Pose-Free 4D Generation via Auto-Regressive Video Inpainting,"Immersive applications call for synthesizing spatiotemporal 4D content from casual videos without costly 3D supervision. Existing video-to-4D methods typically rely on manually annotated camera poses, which are labor-intensive and brittle for in-the-wild footage. Recent warp-then-inpaint approaches mitigate the need for pose labels by warping input frames along a novel camera trajectory and using an inpainting model to fill missing regions, thereby depicting the 4D scene from diverse viewpoints. However, this trajectory-to-trajectory formulation often entangles camera motion with scene dynamics and complicates both modeling and inference. We introduce SEE4D, a pose-free, trajectory-to-camera framework that replaces explicit trajectory prediction with rendering to a bank of fixed virtual cameras, thereby separating camera control from scene modeling. A view-conditional video inpainting model is trained to learn a robust geometry prior by denoising realistically synthesized warped images and to inpaint occluded or missing regions across virtual viewpoints, eliminating the need for explicit 3D annotations. Building on this inpainting core, we design a spatiotemporal autoregressive inference pipeline that traverses virtual-camera splines and extends videos with overlapping windows, enabling coherent generation at bounded per-step complexity. We validate See4D on cross-view video generation and sparse reconstruction benchmarks. Across quantitative metrics and qualitative assessments, our method achieves superior generalization and improved performance relative to pose- or trajectory-conditioned baselines, advancing practical 4D world modeling from casual videos.",http://arxiv.org/abs/2510.26796v1,2025-10-30T17:59:39Z,"Dongyue Lu, Ao Liang, Tianxin Huang, Xiao Fu, Yuyang Zhao, Baorui Ma, Liang Pan, Wei Yin, Lingdong Kong, Wei Tsang Ooi, Ziwei Liu","**Breakthrough in 4D Content Generation: SEE4D**

Imagine being able to generate immersive 4D content from ordinary videos, without the need for expensive 3D modeling or manual camera pose annotations. Researchers have made a significant step towards achieving this goal with the introduction of SEE4D, a pose-free, 4D generation framework.

**The Problem with Current Methods**

Current methods for generating 4D content from videos rely on manually annotated camera poses, which are time-consuming and prone to errors. Recent approaches have attempted to mitigate this issue by warping input frames along a novel camera trajectory and using an inpainting model to fill missing regions. However, these methods often entangle camera motion with scene dynamics, making it challenging to model and infer 4D scenes.

**How SEE4D Works**

SEE4D takes a different approach by separating camera control from scene modeling. Instead of predicting camera trajectories, it renders input frames to a set of fixed virtual cameras, allowing for more flexible and accurate 4D generation. A view-conditional video inpainting model is trained to learn a robust geometry prior by denoising synthesized warped images and filling in occluded or missing regions across virtual viewpoints.

**Key Advantages**

The SEE4D framework offers several key advantages:

* **Pose-free**: No manual camera pose annotations are required, making it more practical for in-the-wild footage.
* **Improved performance**: SEE4D achieves superior generalization and improved performance relative to pose- or trajectory-conditioned baselines.
* **Coherent generation**: The autoregressive inference pipeline enables coherent generation of 4D content at bounded per-step complexity.

**Implications and Future Directions**

The SEE4D framework has significant implications for various applications, including:

* **Immersive experiences**: SEE4D can enable the creation of immersive 4D content for virtual reality, augmented reality, and other applications.
* **Video analysis**: SEE4D can improve video analysis tasks, such as object recognition and tracking, by providing more accurate 4D representations of scenes.

Overall, SEE4D represents a significant advancement in 4D content generation, enabling the creation of immersive and dynamic 4D scenes from ordinary videos without the need for extensive manual annotations or 3D modeling."
cs.CV,Scaling Image Geo-Localization to Continent Level,"Determining the precise geographic location of an image at a global scale remains an unsolved challenge. Standard image retrieval techniques are inefficient due to the sheer volume of images (>100M) and fail when coverage is insufficient. Scalable solutions, however, involve a trade-off: global classification typically yields coarse results (10+ kilometers), while cross-view retrieval between ground and aerial imagery suffers from a domain gap and has been primarily studied on smaller regions. This paper introduces a hybrid approach that achieves fine-grained geo-localization across a large geographic expanse the size of a continent. We leverage a proxy classification task during training to learn rich feature representations that implicitly encode precise location information. We combine these learned prototypes with embeddings of aerial imagery to increase robustness to the sparsity of ground-level data. This enables direct, fine-grained retrieval over areas spanning multiple countries. Our extensive evaluation demonstrates that our approach can localize within 200m more than 68\% of queries of a dataset covering a large part of Europe. The code is publicly available at https://scaling-geoloc.github.io.",http://arxiv.org/abs/2510.26795v1,2025-10-30T17:59:35Z,"Philipp Lindenberger, Paul-Edouard Sarlin, Jan Hosang, Matteo Balice, Marc Pollefeys, Simon Lynen, Eduard Trulls","**Advancing Image Geo-Localization: A Breakthrough in Identifying Locations from Photos**

Imagine being able to pinpoint the exact location of a photo taken anywhere in the world, from a bustling city street to a serene countryside landscape. Researchers have made a significant step towards achieving this goal with a new approach that can accurately identify the location of an image on a continental scale.

The challenge lies in the vast number of images available (over 100 million) and the limited coverage of certain areas, making traditional image retrieval techniques inefficient. Previous solutions have either provided coarse results or been limited to smaller regions.

The innovative approach introduced in this study combines two techniques:

1. **Learning rich feature representations**: By training a model on a proxy task, researchers can extract detailed information from images that implicitly encodes precise location data.
2. **Combining ground and aerial imagery**: By integrating aerial imagery with ground-level images, the model becomes more robust and can handle areas with limited ground-level data.

The results are impressive: the new approach can localize images within 200 meters of their actual location more than 68% of the time, across a vast area covering a significant part of Europe. This achievement has the potential to revolutionize various applications, such as mapping, surveillance, and environmental monitoring.

The code for this approach is publicly available, paving the way for further development and applications in the field of image geo-localization."
cs.CV,"The Quest for Generalizable Motion Generation: Data, Model, and   Evaluation","Despite recent advances in 3D human motion generation (MoGen) on standard benchmarks, existing models still face a fundamental bottleneck in their generalization capability. In contrast, adjacent generative fields, most notably video generation (ViGen), have demonstrated remarkable generalization in modeling human behaviors, highlighting transferable insights that MoGen can leverage. Motivated by this observation, we present a comprehensive framework that systematically transfers knowledge from ViGen to MoGen across three key pillars: data, modeling, and evaluation. First, we introduce ViMoGen-228K, a large-scale dataset comprising 228,000 high-quality motion samples that integrates high-fidelity optical MoCap data with semantically annotated motions from web videos and synthesized samples generated by state-of-the-art ViGen models. The dataset includes both text-motion pairs and text-video-motion triplets, substantially expanding semantic diversity. Second, we propose ViMoGen, a flow-matching-based diffusion transformer that unifies priors from MoCap data and ViGen models through gated multimodal conditioning. To enhance efficiency, we further develop ViMoGen-light, a distilled variant that eliminates video generation dependencies while preserving strong generalization. Finally, we present MBench, a hierarchical benchmark designed for fine-grained evaluation across motion quality, prompt fidelity, and generalization ability. Extensive experiments show that our framework significantly outperforms existing approaches in both automatic and human evaluations. The code, data, and benchmark will be made publicly available.",http://arxiv.org/abs/2510.26794v1,2025-10-30T17:59:27Z,"Jing Lin, Ruisi Wang, Junzhe Lu, Ziqi Huang, Guorui Song, Ailing Zeng, Xian Liu, Chen Wei, Wanqi Yin, Qingping Sun, Zhongang Cai, Lei Yang, Ziwei Liu","Here's a summary of the research paper for a general audience:

**Improving Artificial Intelligence's Ability to Generate Human Motion**

Researchers have made significant progress in creating artificial intelligence (AI) models that can generate 3D human motion, such as walking, running, or dancing. However, these models often struggle to generalize to new situations and environments. To overcome this limitation, the researchers drew inspiration from a related field: video generation. They developed a comprehensive framework that transfers knowledge from video generation to motion generation.

**Key Contributions**

The researchers created:

1. **A large dataset**: A massive collection of 228,000 high-quality motion samples, including data from motion capture technology, web videos, and synthesized samples. This dataset provides a diverse range of human motions and contexts.
2. **A new AI model**: A flow-matching-based diffusion transformer that combines the strengths of motion capture data and video generation models. This model can generate high-quality human motion that generalizes well to new situations.
3. **An efficient variant**: A distilled version of the model that eliminates the need for video generation dependencies while maintaining strong generalization capabilities.
4. **A benchmark for evaluation**: A hierarchical benchmark that assesses motion quality, prompt fidelity, and generalization ability.

**Breakthroughs**

The researchers' framework significantly outperforms existing approaches in both automatic and human evaluations. Their work has the potential to improve AI's ability to generate realistic and diverse human motion, which can be applied to various fields, such as animation, robotics, and virtual reality. The code, data, and benchmark will be made publicly available, enabling further research and development in this area."
cs.CV,HEIR: Learning Graph-Based Motion Hierarchies,"Hierarchical structures of motion exist across research fields, including computer vision, graphics, and robotics, where complex dynamics typically arise from coordinated interactions among simpler motion components. Existing methods to model such dynamics typically rely on manually-defined or heuristic hierarchies with fixed motion primitives, limiting their generalizability across different tasks. In this work, we propose a general hierarchical motion modeling method that learns structured, interpretable motion relationships directly from data. Our method represents observed motions using graph-based hierarchies, explicitly decomposing global absolute motions into parent-inherited patterns and local motion residuals. We formulate hierarchy inference as a differentiable graph learning problem, where vertices represent elemental motions and directed edges capture learned parent-child dependencies through graph neural networks. We evaluate our hierarchical reconstruction approach on three examples: 1D translational motion, 2D rotational motion, and dynamic 3D scene deformation via Gaussian splatting. Experimental results show that our method reconstructs the intrinsic motion hierarchy in 1D and 2D cases, and produces more realistic and interpretable deformations compared to the baseline on dynamic 3D Gaussian splatting scenes. By providing an adaptable, data-driven hierarchical modeling paradigm, our method offers a formulation applicable to a broad range of motion-centric tasks. Project Page: https://light.princeton.edu/HEIR/",http://arxiv.org/abs/2510.26786v1,2025-10-30T17:57:40Z,"Cheng Zheng, William Koch, Baiang Li, Felix Heide","**Breakthrough in Motion Modeling: A New Way to Understand Complex Movement**

Imagine trying to understand a complex dance routine. Instead of looking at the individual steps, researchers have developed a new method to analyze the relationships between different movements. This approach, called HEIR, uses a graph-based system to learn the hierarchical structure of motion from data.

In simple terms, HEIR breaks down complex movements into smaller components and identifies how they relate to each other. For example, in a dance routine, the movement of a single arm might be influenced by the movement of the entire body. HEIR's graph-based system represents these relationships as a tree-like structure, where each node represents a movement and the edges represent the connections between them.

The researchers tested HEIR on three different types of motion: simple 1D movements, 2D rotations, and complex 3D scene deformations. The results showed that HEIR was able to accurately reconstruct the underlying motion hierarchy in the 1D and 2D cases. In the 3D case, HEIR produced more realistic and interpretable results compared to existing methods.

The key innovation of HEIR is that it learns the motion hierarchy directly from data, rather than relying on pre-defined or heuristic structures. This makes it a flexible and adaptable approach that can be applied to a wide range of motion-centric tasks, from computer vision and graphics to robotics.

**What does this mean?**

* HEIR provides a new way to understand complex movements by breaking them down into smaller components and analyzing their relationships.
* This approach has the potential to improve our ability to model and analyze motion in various fields, from computer vision to robotics.
* By learning the motion hierarchy directly from data, HEIR offers a more flexible and adaptable approach than existing methods.

**Why is this important?**

* Understanding complex movements is crucial in many areas, such as robotics, computer vision, and graphics.
* HEIR's approach has the potential to enable more accurate and efficient motion modeling, which could lead to breakthroughs in areas like robotics, animation, and video analysis."
cs.CV,Clone Deterministic 3D Worlds with Geometrically-Regularized World   Models,"A world model is an internal model that simulates how the world evolves. Given past observations and actions, it predicts the future of both the embodied agent and its environment. Accurate world models are essential for enabling agents to think, plan, and reason effectively in complex, dynamic settings. Despite rapid progress, current world models remain brittle and degrade over long horizons. We argue that a central cause is representation quality: exteroceptive inputs (e.g., images) are high-dimensional, and lossy or entangled latents make dynamics learning unnecessarily hard. We therefore ask whether improving representation learning alone can substantially improve world-model performance. In this work, we take a step toward building a truly accurate world model by addressing a fundamental yet open problem: constructing a model that can fully clone and overfit to a deterministic 3D world. We propose Geometrically-Regularized World Models (GRWM), which enforces that consecutive points along a natural sensory trajectory remain close in latent representation space. This approach yields significantly improved latent representations that align closely with the true topology of the environment. GRWM is plug-and-play, requires only minimal architectural modification, scales with trajectory length, and is compatible with diverse latent generative backbones. Across deterministic 3D settings and long-horizon prediction tasks, GRWM significantly increases rollout fidelity and stability. Analyses show that its benefits stem from learning a latent manifold with superior geometric structure. These findings support a clear takeaway: improving representation learning is a direct and useful path to robust world models, delivering reliable long-horizon predictions without enlarging the dynamics module.",http://arxiv.org/abs/2510.26782v1,2025-10-30T17:56:43Z,"Zaishuo Xia, Yukuan Lu, Xinyi Li, Yifan Xu, Yubei Chen","**Breakthrough in Artificial Intelligence: Creating a More Accurate Virtual World**

Imagine a computer program that can simulate a virtual world, predicting what will happen next based on past experiences. This is known as a ""world model,"" and it's essential for developing intelligent agents that can think, plan, and reason in complex environments. However, current world models have limitations, degrading over time and struggling to make accurate long-term predictions.

Researchers have made a significant step forward in addressing this challenge by developing a new approach called Geometrically-Regularized World Models (GRWM). GRWM improves the way the program represents the virtual world, allowing it to learn a more accurate and stable model of the environment.

**Key Innovation:**

The GRWM approach ensures that consecutive points in a virtual trajectory (e.g., a sequence of images) remain close in a latent representation space. This means that the program can better understand the relationships between different parts of the environment, leading to more accurate predictions.

**Impact:**

The GRWM approach has been tested in various 3D environments and has shown significant improvements in long-term prediction tasks. The benefits of GRWM come from learning a latent manifold with superior geometric structure, which enables more accurate and stable predictions.

**Takeaway:**

The study demonstrates that improving representation learning is a direct and useful path to robust world models. By developing more accurate virtual worlds, researchers can create intelligent agents that can think, plan, and reason more effectively in complex environments. This breakthrough has the potential to advance various applications, including robotics, autonomous vehicles, and video games."
cs.CV,ChartAB: A Benchmark for Chart Grounding & Dense Alignment,"Charts play an important role in visualization, reasoning, data analysis, and the exchange of ideas among humans. However, existing vision-language models (VLMs) still lack accurate perception of details and struggle to extract fine-grained structures from charts. Such limitations in chart grounding also hinder their ability to compare multiple charts and reason over them. In this paper, we introduce a novel ""ChartAlign Benchmark (ChartAB)"" to provide a comprehensive evaluation of VLMs in chart grounding tasks, i.e., extracting tabular data, localizing visualization elements, and recognizing various attributes from charts of diverse types and complexities. We design a JSON template to facilitate the calculation of evaluation metrics specifically tailored for each grounding task. By incorporating a novel two-stage inference workflow, the benchmark can further evaluate VLMs' capability to align and compare elements/attributes across two charts. Our analysis of evaluations on several recent VLMs reveals new insights into their perception biases, weaknesses, robustness, and hallucinations in chart understanding. These findings highlight the fine-grained discrepancies among VLMs in chart understanding tasks and point to specific skills that need to be strengthened in current models.",http://arxiv.org/abs/2510.26781v1,2025-10-30T17:56:31Z,"Aniruddh Bansal, Davit Soselia, Dang Nguyen, Tianyi Zhou","Here's a summary of the research paper for a general audience:

**Understanding Charts: A New Benchmark for AI Models**

Charts are a great way to visualize data and help us understand complex information. However, AI models that can understand and interpret charts are still in their early stages. These models struggle to extract detailed information from charts, which makes it hard for them to compare multiple charts and make sense of them.

To address this challenge, researchers have created a new benchmark called ChartAB. This benchmark is a tool that tests how well AI models can understand charts by asking them to perform tasks such as:

* Extracting data from charts
* Identifying different parts of a chart (e.g. labels, titles)
* Recognizing specific attributes of a chart (e.g. colors, shapes)

The researchers used ChartAB to evaluate several recent AI models and found that they have limitations in understanding charts. For example, some models are biased towards certain types of charts or make mistakes when trying to extract information. These findings highlight the need for further research and development to improve AI models' ability to understand and interpret charts.

The creation of ChartAB is an important step towards developing more accurate and reliable AI models that can help us make sense of complex data visualizations."
cs.CV,Surpassing state of the art on AMD area estimation from RGB fundus   images through careful selection of U-Net architectures and loss functions   for class imbalance,"Age-related macular degeneration (AMD) is one of the leading causes of irreversible vision impairment in people over the age of 60. This research focuses on semantic segmentation for AMD lesion detection in RGB fundus images, a non-invasive and cost-effective imaging technique. The results of the ADAM challenge - the most comprehensive AMD detection from RGB fundus images research competition and open dataset to date - serve as a benchmark for our evaluation. Taking the U-Net connectivity as a base of our framework, we evaluate and compare several approaches to improve the segmentation model's architecture and training pipeline, including pre-processing techniques, encoder (backbone) deep network types of varying complexity, and specialized loss functions to mitigate class imbalances on image and pixel levels. The main outcome of this research is the final configuration of the AMD detection framework, which outperforms all the prior ADAM challenge submissions on the multi-class segmentation of different AMD lesion types in non-invasive RGB fundus images. The source code used to conduct the experiments presented in this paper is made freely available.",http://arxiv.org/abs/2510.26778v1,2025-10-30T17:55:46Z,"Valentyna Starodub, Mantas Lukoševičius","Here's a summary of the research paper for a general audience:

**Advancing Detection of Age-Related Macular Degeneration**

Age-related macular degeneration (AMD) is a leading cause of vision loss in people over 60. Researchers have made progress in detecting AMD using a non-invasive and cost-effective imaging technique called RGB fundus imaging. This technique takes pictures of the back of the eye to identify lesions that can cause vision loss.

In this study, researchers tested different approaches to improve the accuracy of a computer model called U-Net in detecting AMD lesions from RGB fundus images. They compared various techniques, such as data pre-processing, different types of neural networks, and specialized loss functions to handle imbalances in the data.

The researchers found that by carefully selecting the right combination of techniques, they could create a model that outperforms previous state-of-the-art models in detecting different types of AMD lesions. This breakthrough has the potential to improve the diagnosis and treatment of AMD, and the researchers have made their code freely available to others.

**In simple terms:** This study used computer algorithms to analyze images of the eye to detect age-related macular degeneration (AMD). By testing different approaches, the researchers developed a more accurate model that can help doctors diagnose and treat AMD more effectively."
